{"$schema":"https://json-schema.org/draft/2020-12/schema","additionalProperties":false,"description":"Closed registry envelope; semantic and hash validation is enforced by dpslab.patch_source_adapter.","properties":{"identity":{"type":"object"},"integrity":{"type":"object"},"schema_version":{"const":"0.1"},"sources":{"items":{"type":"object"},"minItems":1,"type":"array"}},"required":["schema_version","identity","sources","integrity"],"title":"DpsLab patch source registry 0.1","type":"object"}
