{"identity":{"created_at":"2026-07-31T14:00:00Z","registry_id":"synthetic.patch.sources.0.1","wow_product":"retail"},"integrity":{"hash_algorithm":"sha256","registry_sha256":"1d0456145a569c9f0c1fcdfce7ade4fbac11bc724efe110bc76682be1eb3963c"},"schema_version":"0.1","sources":[{"canonical_host":"patches.synthetic.invalid","locale_policy":"en_us_canonical","max_bytes":1024,"media_types":["application/json","text/plain"],"owner":"synthetic.publisher","redirect_hosts":["cdn.synthetic.invalid"],"review_owner":"dpslab.knowledge.review","source_id":"synthetic.official.patch"}]}
