{"identity":{"created_at":"2026-08-01T19:12:00Z","registry_id":"dpslab.official.patch.sources.001","wow_product":"retail"},"integrity":{"hash_algorithm":"sha256","registry_sha256":"dbd54a40d3ed180d4b87789f114d4512cd154636e5b0b5394d35d61fa949c9fc"},"schema_version":"0.1","sources":[{"canonical_host":"worldofwarcraft.blizzard.com","locale_policy":"en_us_canonical","max_bytes":1048576,"media_types":["text/html"],"owner":"blizzard","redirect_hosts":[],"review_owner":"dpslab.maintainer","source_id":"blizzard.wow.content_update_notes"}]}
